{"domain":{"actions":[],"component_types":[{"connections":[],"events":[],"id":"domain/component/tank","methods":[],"name":"tank","ports":[{"connector_type":"fluid","id":"domain/component/tank/port/terminal","name":"terminal","presence":"required"}],"processes":[{"effects":[{"operator":"increase","rate":{"field":"mass-flow","kind":"port_field","port":{"instance":{"anchor":"self","segments":[]},"port":"terminal"}},"target":{"arguments":[],"kind":"call","name":"volume"}}],"id":"domain/component/tank/process/inventory","name":"inventory","parameters":[],"precondition":{"kind":"boolean","value":true}}],"requirements":[{"formula":{"kind":"compare","left":{"field":"pressure","kind":"port_field","port":{"instance":{"anchor":"self","segments":[]},"port":"terminal"}},"operator":"=","right":{"arguments":[],"kind":"call","name":"pressure"}},"id":"domain/component/tank/requirement/0"},{"formula":{"kind":"compare","left":{"arguments":[],"kind":"call","name":"volume"},"operator":">=","right":{"kind":"number","value":"0"}},"id":"domain/component/tank/requirement/1"}],"subcomponents":[],"variables":[{"id":"domain/component/tank/variable/volume","name":"volume","parameters":[],"static":false,"value_type":"number"},{"id":"domain/component/tank/variable/pressure","name":"pressure","parameters":[],"static":true,"value_type":"number"}]},{"connections":[],"events":[],"id":"domain/component/valve","methods":[{"effect":{"kind":"assign","target":{"arguments":[],"kind":"call","name":"mode"},"value":{"kind":"symbol","name":"open"}},"id":"domain/component/valve/method/open","name":"open","parameters":[],"precondition":{"kind":"compare","left":{"arguments":[],"kind":"call","name":"mode"},"operator":"=","right":{"kind":"symbol","name":"closed"}}},{"effect":{"kind":"assign","target":{"arguments":[],"kind":"call","name":"mode"},"value":{"kind":"symbol","name":"closed"}},"id":"domain/component/valve/method/close","name":"close","parameters":[],"precondition":{"kind":"compare","left":{"arguments":[],"kind":"call","name":"mode"},"operator":"=","right":{"kind":"symbol","name":"open"}}}],"name":"valve","ports":[{"connector_type":"fluid","id":"domain/component/valve/port/inlet","name":"inlet","presence":"required"},{"connector_type":"fluid","id":"domain/component/valve/port/outlet","name":"outlet","presence":"required"}],"processes":[],"requirements":[{"formula":{"kind":"compare","left":{"arguments":[{"field":"mass-flow","kind":"port_field","port":{"instance":{"anchor":"self","segments":[]},"port":"inlet"}},{"field":"mass-flow","kind":"port_field","port":{"instance":{"anchor":"self","segments":[]},"port":"outlet"}}],"kind":"arithmetic","operator":"+"},"operator":"=","right":{"kind":"number","value":"0"}},"id":"domain/component/valve/requirement/0"},{"formula":{"antecedent":{"kind":"compare","left":{"arguments":[],"kind":"call","name":"mode"},"operator":"=","right":{"kind":"symbol","name":"closed"}},"consequent":{"kind":"compare","left":{"field":"mass-flow","kind":"port_field","port":{"instance":{"anchor":"self","segments":[]},"port":"inlet"}},"operator":"=","right":{"kind":"number","value":"0"}},"kind":"imply"},"id":"domain/component/valve/requirement/1"},{"formula":{"antecedent":{"kind":"compare","left":{"arguments":[],"kind":"call","name":"mode"},"operator":"=","right":{"kind":"symbol","name":"open"}},"consequent":{"kind":"compare","left":{"field":"mass-flow","kind":"port_field","port":{"instance":{"anchor":"self","segments":[]},"port":"inlet"}},"operator":"=","right":{"arguments":[],"kind":"call","name":"rated-flow"}},"kind":"imply"},"id":"domain/component/valve/requirement/2"}],"subcomponents":[],"variables":[{"id":"domain/component/valve/variable/mode","name":"mode","parameters":[],"static":false,"value_type":"object"},{"id":"domain/component/valve/variable/rated-flow","name":"rated-flow","parameters":[],"static":true,"value_type":"number"}]},{"connections":[{"id":"domain/component/two-tank-plant/connection/0","ports":[{"instance":{"anchor":"self","segments":["supply"]},"port":"terminal"},{"instance":{"anchor":"self","segments":["transfer"]},"port":"inlet"}]},{"id":"domain/component/two-tank-plant/connection/1","ports":[{"instance":{"anchor":"self","segments":["transfer"]},"port":"outlet"},{"instance":{"anchor":"self","segments":["receiver"]},"port":"terminal"}]}],"events":[],"id":"domain/component/two-tank-plant","methods":[],"name":"two-tank-plant","ports":[],"processes":[],"requirements":[],"subcomponents":[{"component_type":"tank","id":"domain/component/two-tank-plant/subcomponent/supply","name":"supply"},{"component_type":"valve","id":"domain/component/two-tank-plant/subcomponent/transfer","name":"transfer"},{"component_type":"tank","id":"domain/component/two-tank-plant/subcomponent/receiver","name":"receiver"}],"variables":[]}],"connector_types":[{"fields":[{"category":"potential","name":"pressure","value_type":"number"},{"category":"flow","name":"mass-flow","value_type":"number"}],"id":"domain/connector/fluid","name":"fluid"}],"constants":[],"derived_predicates":[],"durative_actions":[],"events":[],"functions":[],"id":"domain","name":"coupled-tanks","predicates":[],"processes":[],"requirements":[":typing",":numeric-fluents",":components",":component-hierarchy",":acausal-connectors",":processes",":continuous-effects"],"types":[]},"format":"pddlica-json","language":{"host_features":["pddl2.1","pddl+","pddl3"],"host_language":"pddl","name":"pddlica","version":"0.5"},"metadata":{"extensions":{},"producer":"pddlica-parser-julia","producer_version":"0.1.0","semantic_digest":"sha256:2c299bf001998f95ffd515edbc0ee0899f2628275040b2c516fa9844674402e7"},"problem":{"components":[{"component_type":"two-tank-plant","id":"problem/component/plant","name":"plant","present":true}],"connections":[],"constraints":[],"domain":"coupled-tanks","goal":{"kind":"compare","left":{"arguments":[{"kind":"symbol","name":"plant.receiver"}],"kind":"call","name":"volume"},"operator":">=","right":{"kind":"number","value":"4"}},"id":"problem","init":[{"id":"problem/init/0","kind":"equality","left":{"arguments":[{"kind":"symbol","name":"plant.supply"}],"kind":"call","name":"volume"},"right":{"kind":"number","value":"10"}},{"id":"problem/init/1","kind":"equality","left":{"arguments":[{"kind":"symbol","name":"plant.supply"}],"kind":"call","name":"pressure"},"right":{"kind":"number","value":"1"}},{"id":"problem/init/2","kind":"equality","left":{"arguments":[{"kind":"symbol","name":"plant.transfer"}],"kind":"call","name":"mode"},"right":{"kind":"symbol","name":"closed"}},{"id":"problem/init/3","kind":"equality","left":{"arguments":[{"kind":"symbol","name":"plant.transfer"}],"kind":"call","name":"rated-flow"},"right":{"kind":"number","value":"1"}},{"id":"problem/init/4","kind":"equality","left":{"arguments":[{"kind":"symbol","name":"plant.receiver"}],"kind":"call","name":"volume"},"right":{"kind":"number","value":"0"}},{"id":"problem/init/5","kind":"equality","left":{"arguments":[{"kind":"symbol","name":"plant.receiver"}],"kind":"call","name":"pressure"},"right":{"kind":"number","value":"1"}}],"metric":null,"name":"coupled-tanks-problem","objects":[],"preferences":[],"timed_initials":[]},"source_map":{"documents":[{"content_digest":"sha256:93e65538b13c7bf9acbb08210f19b47cb7f0710c06aeebbe646802e017652e2d","id":"domain-source","logical_name":"domain.plca","role":"domain"},{"content_digest":"sha256:2dfac90ce462d0c2b4affa93ea778cb0838c29712d71796df5a49276ba8ff105","id":"problem-source","logical_name":"problem.plca","role":"problem"}],"locations":{"domain":{"document":"domain-source","end_byte":1588,"start_byte":0,"start_column":1,"start_line":1},"domain/component/tank":{"document":"domain-source","end_byte":671,"start_byte":271,"start_column":3,"start_line":9},"domain/component/tank/process/inventory":{"document":"domain-source","end_byte":669,"start_byte":533,"start_column":7,"start_line":18},"domain/component/two-tank-plant":{"document":"domain-source","end_byte":1587,"start_byte":1347,"start_column":3,"start_line":43},"domain/component/valve":{"document":"domain-source","end_byte":1343,"start_byte":675,"start_column":3,"start_line":23},"domain/component/valve/method/close":{"document":"domain-source","end_byte":1341,"start_byte":1226,"start_column":7,"start_line":38},"domain/component/valve/method/open":{"document":"domain-source","end_byte":1219,"start_byte":1105,"start_column":7,"start_line":34},"domain/connector/fluid":{"document":"domain-source","end_byte":267,"start_byte":178,"start_column":3,"start_line":5},"problem":{"document":"problem-source","end_byte":378,"start_byte":0,"start_column":1,"start_line":1},"problem/init/0":{"document":"problem-source","end_byte":152,"start_byte":124,"start_column":5,"start_line":6},"problem/init/1":{"document":"problem-source","end_byte":186,"start_byte":157,"start_column":5,"start_line":7},"problem/init/2":{"document":"problem-source","end_byte":223,"start_byte":191,"start_column":5,"start_line":8},"problem/init/3":{"document":"problem-source","end_byte":261,"start_byte":228,"start_column":5,"start_line":9},"problem/init/4":{"document":"problem-source","end_byte":295,"start_byte":266,"start_column":5,"start_line":10},"problem/init/5":{"document":"problem-source","end_byte":331,"start_byte":300,"start_column":5,"start_line":11}}},"version":"0.1"}