{"domain":{"actions":[],"component_types":[{"connections":[],"events":[],"id":"domain/component/worker","methods":[{"effect":{"kind":"assign","target":{"arguments":[],"kind":"call","name":"mode"},"value":{"kind":"symbol","name":"active"}},"id":"domain/component/worker/method/start","name":"start","parameters":[],"precondition":{"kind":"compare","left":{"arguments":[],"kind":"call","name":"mode"},"operator":"=","right":{"kind":"symbol","name":"idle"}}},{"effect":{"kind":"assign","target":{"arguments":[],"kind":"call","name":"mode"},"value":{"kind":"symbol","name":"done"}},"id":"domain/component/worker/method/stop","name":"stop","parameters":[],"precondition":{"kind":"compare","left":{"arguments":[],"kind":"call","name":"mode"},"operator":"=","right":{"kind":"symbol","name":"active"}}}],"name":"worker","ports":[],"processes":[{"effects":[{"operator":"increase","rate":{"kind":"number","value":"1"},"target":{"arguments":[],"kind":"call","name":"progress"}}],"id":"domain/component/worker/process/work","name":"work","parameters":[],"precondition":{"kind":"compare","left":{"arguments":[],"kind":"call","name":"mode"},"operator":"=","right":{"kind":"symbol","name":"active"}}}],"requirements":[],"subcomponents":[],"variables":[{"id":"domain/component/worker/variable/mode","name":"mode","parameters":[],"static":false,"value_type":"object"},{"id":"domain/component/worker/variable/progress","name":"progress","parameters":[],"static":false,"value_type":"number"}]}],"connector_types":[],"constants":[],"derived_predicates":[],"durative_actions":[],"events":[],"functions":[],"id":"domain","name":"cushing-adaptation","predicates":[],"processes":[],"requirements":[":typing",":numeric-fluents",":components",":processes",":continuous-effects"],"types":[{"id":"domain/type/worker","name":"worker","parent":"component"}]},"format":"pddlica-json","language":{"host_features":["pddl2.1","pddl+","pddl3"],"host_language":"pddl","name":"pddlica","version":"0.5"},"metadata":{"extensions":{},"producer":"pddlica-parser-julia","producer_version":"0.1.0","semantic_digest":"sha256:920b6df0eb9e764b5232170c38035986047bd90c78c4af85a09382fff75a4de5"},"problem":{"components":[{"component_type":"worker","id":"problem/component/left","name":"left","present":true},{"component_type":"worker","id":"problem/component/right","name":"right","present":true}],"connections":[],"constraints":[],"domain":"cushing-adaptation","goal":{"items":[{"kind":"compare","left":{"arguments":[{"kind":"symbol","name":"left"}],"kind":"call","name":"progress"},"operator":">=","right":{"kind":"number","value":"2"}},{"kind":"compare","left":{"arguments":[{"kind":"symbol","name":"right"}],"kind":"call","name":"progress"},"operator":">=","right":{"kind":"number","value":"2"}}],"kind":"and"},"id":"problem","init":[{"id":"problem/init/0","kind":"equality","left":{"arguments":[{"kind":"symbol","name":"left"}],"kind":"call","name":"mode"},"right":{"kind":"symbol","name":"idle"}},{"id":"problem/init/1","kind":"equality","left":{"arguments":[{"kind":"symbol","name":"left"}],"kind":"call","name":"progress"},"right":{"kind":"number","value":"0"}},{"id":"problem/init/2","kind":"equality","left":{"arguments":[{"kind":"symbol","name":"right"}],"kind":"call","name":"mode"},"right":{"kind":"symbol","name":"idle"}},{"id":"problem/init/3","kind":"equality","left":{"arguments":[{"kind":"symbol","name":"right"}],"kind":"call","name":"progress"},"right":{"kind":"number","value":"0"}}],"name":"cushing-overlap","objects":[]},"source_map":{"documents":[{"content_digest":"sha256:9bb0617074ed4f964900f430f8d71c65e96c89824f0dabbb68fc61de9108bbfa","id":"domain-source","logical_name":"domain.plca","role":"domain"},{"content_digest":"sha256:5270bf8296be9948e2dda85a70208876e76697b5fa2631dbe9ebff17335703cc","id":"problem-source","logical_name":"problem.plca","role":"problem"}],"locations":{}},"version":"0.1"}