{"domain":{"actions":[],"component_types":[{"connections":[],"events":[],"id":"domain/component/job","methods":[{"effect":{"kind":"assign","target":{"arguments":[],"kind":"call","name":"mode"},"value":{"kind":"symbol","name":"running"}},"id":"domain/component/job/method/admit","name":"admit","parameters":[],"precondition":{"kind":"compare","left":{"arguments":[],"kind":"call","name":"mode"},"operator":"=","right":{"kind":"symbol","name":"waiting"}}}],"name":"job","ports":[],"processes":[{"effects":[{"operator":"increase","rate":{"arguments":[],"kind":"call","name":"rate"},"target":{"arguments":[],"kind":"call","name":"work"}}],"id":"domain/component/job/process/execute","name":"execute","parameters":[],"precondition":{"kind":"compare","left":{"arguments":[],"kind":"call","name":"mode"},"operator":"=","right":{"kind":"symbol","name":"running"}}}],"requirements":[],"subcomponents":[],"variables":[{"id":"domain/component/job/variable/mode","name":"mode","parameters":[],"static":false,"value_type":"object"},{"id":"domain/component/job/variable/work","name":"work","parameters":[],"static":false,"value_type":"number"},{"id":"domain/component/job/variable/rate","name":"rate","parameters":[],"static":true,"value_type":"number"}]}],"connector_types":[],"constants":[],"derived_predicates":[],"durative_actions":[],"events":[],"functions":[],"id":"domain","name":"oversub-adaptation","predicates":[],"processes":[],"requirements":[":typing",":numeric-fluents",":components",":processes",":continuous-effects"],"types":[{"id":"domain/type/job","name":"job","parent":"component"}]},"format":"pddlica-json","language":{"host_features":["pddl2.1","pddl+","pddl3"],"host_language":"pddl","name":"pddlica","version":"0.5"},"metadata":{"extensions":{},"producer":"pddlica-parser-julia","producer_version":"0.1.0","semantic_digest":"sha256:299759179eec0b60e642a692301206bd64191531dbe3c29540e9e9f264ea46f6"},"problem":{"components":[{"component_type":"job","id":"problem/component/important","name":"important","present":true},{"component_type":"job","id":"problem/component/optional","name":"optional","present":true}],"connections":[],"constraints":[],"domain":"oversub-adaptation","goal":{"kind":"compare","left":{"arguments":[{"kind":"symbol","name":"important"}],"kind":"call","name":"work"},"operator":">=","right":{"kind":"number","value":"3"}},"id":"problem","init":[{"id":"problem/init/0","kind":"equality","left":{"arguments":[{"kind":"symbol","name":"important"}],"kind":"call","name":"mode"},"right":{"kind":"symbol","name":"waiting"}},{"id":"problem/init/1","kind":"equality","left":{"arguments":[{"kind":"symbol","name":"important"}],"kind":"call","name":"work"},"right":{"kind":"number","value":"0"}},{"id":"problem/init/2","kind":"equality","left":{"arguments":[{"kind":"symbol","name":"important"}],"kind":"call","name":"rate"},"right":{"kind":"number","value":"1"}},{"id":"problem/init/3","kind":"equality","left":{"arguments":[{"kind":"symbol","name":"optional"}],"kind":"call","name":"mode"},"right":{"kind":"symbol","name":"waiting"}},{"id":"problem/init/4","kind":"equality","left":{"arguments":[{"kind":"symbol","name":"optional"}],"kind":"call","name":"work"},"right":{"kind":"number","value":"0"}},{"id":"problem/init/5","kind":"equality","left":{"arguments":[{"kind":"symbol","name":"optional"}],"kind":"call","name":"rate"},"right":{"kind":"number","value":"1"}}],"name":"oversub-feasible","objects":[]},"source_map":{"documents":[{"content_digest":"sha256:dc2c81a0535764fea9c1893393bf8d64b59fb823ab5201f0257682d203d9396c","id":"domain-source","logical_name":"domain.plca","role":"domain"},{"content_digest":"sha256:a39d4ba0d5af6608d72eb4ef014305407fafef29bee09488b3725dabbb3ccaad","id":"problem-source","logical_name":"problem.plca","role":"problem"}],"locations":{}},"version":"0.1"}