{"domain":{"actions":[],"component_types":[{"connections":[],"events":[],"id":"domain/component/heat-source","methods":[],"name":"heat-source","ports":[{"connector_type":"heat-port","id":"domain/component/heat-source/port/port","name":"port","presence":"required"}],"processes":[],"requirements":[{"formula":{"kind":"compare","left":{"field":"temperature","kind":"port_field","port":{"instance":{"anchor":"self","segments":[]},"port":"port"}},"operator":"=","right":{"arguments":[],"kind":"call","name":"source-temperature"}},"id":"domain/component/heat-source/requirement/0"},{"formula":{"kind":"compare","left":{"field":"heat-flow","kind":"port_field","port":{"instance":{"anchor":"self","segments":[]},"port":"port"}},"operator":"=","right":{"kind":"number","value":"-1"}},"id":"domain/component/heat-source/requirement/1"}],"subcomponents":[],"variables":[{"id":"domain/component/heat-source/variable/source-temperature","name":"source-temperature","parameters":[],"static":true,"value_type":"number"}]},{"connections":[],"events":[],"id":"domain/component/heat-load","methods":[],"name":"heat-load","ports":[{"connector_type":"heat-port","id":"domain/component/heat-load/port/port","name":"port","presence":"required"}],"processes":[{"effects":[{"operator":"increase","rate":{"field":"heat-flow","kind":"port_field","port":{"instance":{"anchor":"self","segments":[]},"port":"port"}},"target":{"arguments":[],"kind":"call","name":"energy"}}],"id":"domain/component/heat-load/process/absorb","name":"absorb","parameters":[],"precondition":{"kind":"boolean","value":true}}],"requirements":[],"subcomponents":[],"variables":[{"id":"domain/component/heat-load/variable/energy","name":"energy","parameters":[],"static":false,"value_type":"number"}]}],"connector_types":[{"fields":[{"category":"potential","name":"temperature","value_type":"number"},{"category":"flow","name":"heat-flow","value_type":"number"}],"id":"domain/connector/heat-port","name":"heat-port"}],"constants":[],"derived_predicates":[],"durative_actions":[],"events":[],"functions":[],"id":"domain","name":"match-ac-adaptation","predicates":[],"processes":[],"requirements":[":typing",":numeric-fluents",":components",":acausal-connectors",":processes",":continuous-effects"],"types":[]},"format":"pddlica-json","language":{"host_features":["pddl2.1","pddl+","pddl3"],"host_language":"pddl","name":"pddlica","version":"0.5"},"metadata":{"extensions":{},"producer":"pddlica-parser-julia","producer_version":"0.1.0","semantic_digest":"sha256:6283a45f2ca45f2f5472cfa6774eb11a146fb8f8579c09735096fca6b79a365b"},"problem":{"components":[{"component_type":"heat-source","id":"problem/component/source","name":"source","present":true},{"component_type":"heat-load","id":"problem/component/load","name":"load","present":true}],"connections":[{"id":"problem/connection/0","ports":[{"instance":{"anchor":"problem","segments":["source"]},"port":"port"},{"instance":{"anchor":"problem","segments":["load"]},"port":"port"}]}],"constraints":[],"domain":"match-ac-adaptation","goal":{"kind":"compare","left":{"arguments":[{"kind":"symbol","name":"load"}],"kind":"call","name":"energy"},"operator":">=","right":{"kind":"number","value":"2"}},"id":"problem","init":[{"id":"problem/init/0","kind":"equality","left":{"arguments":[{"kind":"symbol","name":"source"}],"kind":"call","name":"source-temperature"},"right":{"kind":"number","value":"100"}},{"id":"problem/init/1","kind":"equality","left":{"arguments":[{"kind":"symbol","name":"load"}],"kind":"call","name":"energy"},"right":{"kind":"number","value":"0"}}],"metric":null,"name":"match-ac-demo","objects":[],"preferences":[],"timed_initials":[]},"source_map":{"documents":[{"content_digest":"sha256:6c136f7fe261bcee6e4ceaf32d67d8e44d43be6acc8f9c155ff65e96b9fbcff9","id":"domain-source","logical_name":"domain.plca","role":"domain"},{"content_digest":"sha256:c4b53c2be320ca26d5f4b5e50e5148d9daa69d2c220d45fab0bf1c8f668461b1","id":"problem-source","logical_name":"problem.plca","role":"problem"}],"locations":{"domain":{"document":"domain-source","end_byte":725,"start_byte":0,"start_column":1,"start_line":1},"domain/component/heat-load":{"document":"domain-source","end_byte":724,"start_byte":479,"start_column":3,"start_line":9},"domain/component/heat-load/process/absorb":{"document":"domain-source","end_byte":722,"start_byte":609,"start_column":7,"start_line":13},"domain/component/heat-source":{"document":"domain-source","end_byte":476,"start_byte":236,"start_column":3,"start_line":4},"domain/connector/heat-port":{"document":"domain-source","end_byte":233,"start_byte":145,"start_column":3,"start_line":3},"problem":{"document":"problem-source","end_byte":300,"start_byte":0,"start_column":1,"start_line":1},"problem/connection/0":{"document":"problem-source","end_byte":201,"start_byte":166,"start_column":17,"start_line":4},"problem/init/0":{"document":"problem-source","end_byte":247,"start_byte":212,"start_column":10,"start_line":5},"problem/init/1":{"document":"problem-source","end_byte":267,"start_byte":248,"start_column":46,"start_line":5}}},"version":"0.1"}