{"domain":{"actions":[{"effect":{"items":[{"component":{"kind":"symbol","name":"memory-unit"},"kind":"remove"},{"atom":{"arguments":[],"name":"removed"},"kind":"set_atom","value":true}],"kind":"and"},"id":"domain/action/remove-memory","name":"remove-memory","parameters":[],"precondition":{"component":{"kind":"symbol","name":"memory-unit"},"kind":"present"}},{"effect":{"items":[{"component":{"kind":"symbol","name":"memory-unit"},"kind":"create"},{"atom":{"arguments":[],"name":"restored"},"kind":"set_atom","value":true}],"kind":"and"},"id":"domain/action/restore-memory","name":"restore-memory","parameters":[],"precondition":{"items":[{"item":{"component":{"kind":"symbol","name":"memory-unit"},"kind":"present"},"kind":"not"},{"arguments":[],"kind":"atom","name":"removed"}],"kind":"and"}}],"component_types":[{"connections":[],"events":[],"id":"domain/component/anchor","methods":[],"name":"anchor","ports":[{"connector_type":"signal","id":"domain/component/anchor/port/terminal","name":"terminal","presence":"optional"}],"processes":[],"requirements":[{"formula":{"kind":"compare","left":{"field":"value","kind":"port_field","port":{"instance":{"anchor":"self","segments":[]},"port":"terminal"}},"operator":"=","right":{"arguments":[],"kind":"call","name":"setpoint"}},"id":"domain/component/anchor/requirement/0"},{"formula":{"kind":"compare","left":{"field":"flow","kind":"port_field","port":{"instance":{"anchor":"self","segments":[]},"port":"terminal"}},"operator":"=","right":{"kind":"number","value":"0"}},"id":"domain/component/anchor/requirement/1"}],"subcomponents":[],"variables":[{"id":"domain/component/anchor/variable/setpoint","name":"setpoint","parameters":[],"static":true,"value_type":"number"}]},{"connections":[],"events":[],"id":"domain/component/memory","methods":[{"effect":{"kind":"assign","target":{"arguments":[],"kind":"call","name":"stored"},"value":{"kind":"number","value":"7"}},"id":"domain/component/memory/method/remember","name":"remember","parameters":[],"precondition":{"kind":"boolean","value":true}}],"name":"memory","ports":[{"connector_type":"signal","id":"domain/component/memory/port/terminal","name":"terminal","presence":"optional"}],"processes":[],"requirements":[{"formula":{"kind":"compare","left":{"field":"value","kind":"port_field","port":{"instance":{"anchor":"self","segments":[]},"port":"terminal"}},"operator":"=","right":{"arguments":[],"kind":"call","name":"setpoint"}},"id":"domain/component/memory/requirement/0"},{"formula":{"kind":"compare","left":{"field":"flow","kind":"port_field","port":{"instance":{"anchor":"self","segments":[]},"port":"terminal"}},"operator":"=","right":{"kind":"number","value":"0"}},"id":"domain/component/memory/requirement/1"}],"subcomponents":[],"variables":[{"id":"domain/component/memory/variable/stored","name":"stored","parameters":[],"static":false,"value_type":"number"},{"id":"domain/component/memory/variable/setpoint","name":"setpoint","parameters":[],"static":true,"value_type":"number"}]}],"connector_types":[{"fields":[{"category":"potential","name":"value","value_type":"number"},{"category":"flow","name":"flow","value_type":"number"}],"id":"domain/connector/signal","name":"signal"}],"constants":[],"derived_predicates":[],"durative_actions":[],"events":[],"functions":[],"id":"domain","name":"lifecycle-demo","predicates":[{"id":"domain/predicate/removed","name":"removed","parameters":[]},{"id":"domain/predicate/restored","name":"restored","parameters":[]}],"processes":[],"requirements":[":typing",":numeric-fluents",":components",":acausal-connectors",":component-presence"],"types":[]},"format":"pddlica-json","language":{"host_features":["pddl2.1","pddl+","pddl3"],"host_language":"pddl","name":"pddlica","version":"0.5"},"metadata":{"extensions":{},"producer":"pddlica-parser-julia","producer_version":"0.1.0","semantic_digest":"sha256:8b6980b324084ed00b7f199a55965496c1b114bb1e9682b8d252eb31135321b8"},"problem":{"components":[{"component_type":"anchor","id":"problem/component/reference","name":"reference","present":true},{"component_type":"memory","id":"problem/component/memory-unit","name":"memory-unit","present":true}],"connections":[{"id":"problem/connection/0","ports":[{"instance":{"anchor":"problem","segments":["reference"]},"port":"terminal"},{"instance":{"anchor":"problem","segments":["memory-unit"]},"port":"terminal"}]}],"constraints":[],"domain":"lifecycle-demo","goal":{"items":[{"component":{"kind":"symbol","name":"memory-unit"},"kind":"present"},{"arguments":[],"kind":"atom","name":"restored"},{"kind":"compare","left":{"arguments":[{"kind":"symbol","name":"memory-unit"}],"kind":"call","name":"stored"},"operator":"=","right":{"kind":"number","value":"7"}}],"kind":"and"},"id":"problem","init":[{"id":"problem/init/0","kind":"equality","left":{"arguments":[{"kind":"symbol","name":"reference"}],"kind":"call","name":"setpoint"},"right":{"kind":"number","value":"1"}},{"id":"problem/init/1","kind":"equality","left":{"arguments":[{"kind":"symbol","name":"memory-unit"}],"kind":"call","name":"stored"},"right":{"kind":"number","value":"0"}},{"id":"problem/init/2","kind":"equality","left":{"arguments":[{"kind":"symbol","name":"memory-unit"}],"kind":"call","name":"setpoint"},"right":{"kind":"number","value":"1"}}],"metric":null,"name":"lifecycle-problem","objects":[],"preferences":[],"timed_initials":[]},"source_map":{"documents":[{"content_digest":"sha256:e2478b0ca954326f8cb5907a3e3d2de10d567b04236028cabc4055aaaf2884d4","id":"domain-source","logical_name":"domain.plca","role":"domain"},{"content_digest":"sha256:ce2d0177e65b9da09efccd4cde4a5a1a3b8fe6c71018a6e171f0068cfe4857f2","id":"problem-source","logical_name":"problem.plca","role":"problem"}],"locations":{"domain":{"document":"domain-source","end_byte":1176,"start_byte":0,"start_column":1,"start_line":1},"domain/action/remove-memory":{"document":"domain-source","end_byte":1016,"start_byte":885,"start_column":3,"start_line":35},"domain/action/restore-memory":{"document":"domain-source","end_byte":1175,"start_byte":1020,"start_column":3,"start_line":40},"domain/component/anchor":{"document":"domain-source","end_byte":503,"start_byte":279,"start_column":3,"start_line":13},"domain/component/memory":{"document":"domain-source","end_byte":881,"start_byte":507,"start_column":3,"start_line":21},"domain/component/memory/method/remember":{"document":"domain-source","end_byte":879,"start_byte":775,"start_column":7,"start_line":30},"domain/connector/signal":{"document":"domain-source","end_byte":229,"start_byte":147,"start_column":3,"start_line":5},"problem":{"document":"problem-source","end_byte":437,"start_byte":0,"start_column":1,"start_line":1},"problem/connection/0":{"document":"problem-source","end_byte":232,"start_byte":179,"start_column":5,"start_line":7},"problem/init/0":{"document":"problem-source","end_byte":273,"start_byte":247,"start_column":5,"start_line":9},"problem/init/1":{"document":"problem-source","end_byte":304,"start_byte":278,"start_column":5,"start_line":10},"problem/init/2":{"document":"problem-source","end_byte":337,"start_byte":309,"start_column":5,"start_line":11}}},"version":"0.1"}