{"domain":{"actions":[],"component_types":[{"connections":[],"events":[],"id":"domain/component/tank","methods":[],"name":"tank","ports":[{"connector_type":"fluid-port","id":"domain/component/tank/port/inlet","name":"inlet","presence":"optional"},{"connector_type":"fluid-port","id":"domain/component/tank/port/outlet","name":"outlet","presence":"optional"}],"processes":[{"effects":[{"operator":"increase","rate":{"arguments":[{"field":"mass-flow","kind":"port_field","port":{"instance":{"anchor":"self","segments":[]},"port":"inlet"}},{"field":"mass-flow","kind":"port_field","port":{"instance":{"anchor":"self","segments":[]},"port":"outlet"}}],"kind":"arithmetic","operator":"+"},"target":{"arguments":[],"kind":"call","name":"volume"}}],"id":"domain/component/tank/process/fluid-balance","name":"fluid-balance","parameters":[],"precondition":{"kind":"boolean","value":true}}],"requirements":[{"formula":{"items":[{"kind":"compare","left":{"arguments":[],"kind":"call","name":"volume"},"operator":">=","right":{"kind":"number","value":"0"}},{"kind":"compare","left":{"arguments":[],"kind":"call","name":"volume"},"operator":"<=","right":{"arguments":[],"kind":"call","name":"capacity"}}],"kind":"and"},"id":"domain/component/tank/requirement/0"},{"formula":{"kind":"compare","left":{"field":"pressure","kind":"port_field","port":{"instance":{"anchor":"self","segments":[]},"port":"inlet"}},"operator":"=","right":{"arguments":[],"kind":"call","name":"internal-pressure"}},"id":"domain/component/tank/requirement/1"},{"formula":{"kind":"compare","left":{"field":"pressure","kind":"port_field","port":{"instance":{"anchor":"self","segments":[]},"port":"outlet"}},"operator":"=","right":{"arguments":[],"kind":"call","name":"internal-pressure"}},"id":"domain/component/tank/requirement/2"}],"subcomponents":[],"variables":[{"id":"domain/component/tank/variable/volume","name":"volume","parameters":[],"static":false,"value_type":"number"},{"id":"domain/component/tank/variable/capacity","name":"capacity","parameters":[],"static":true,"value_type":"number"},{"id":"domain/component/tank/variable/internal-pressure","name":"internal-pressure","parameters":[],"static":true,"value_type":"number"}]},{"connections":[],"events":[],"id":"domain/component/pump","methods":[{"effect":{"kind":"assign","target":{"arguments":[],"kind":"call","name":"mode"},"value":{"kind":"symbol","name":"running"}},"id":"domain/component/pump/method/switch-on","name":"switch-on","parameters":[],"precondition":{"kind":"compare","left":{"arguments":[],"kind":"call","name":"mode"},"operator":"=","right":{"kind":"symbol","name":"off"}}},{"effect":{"kind":"assign","target":{"arguments":[],"kind":"call","name":"mode"},"value":{"kind":"symbol","name":"off"}},"id":"domain/component/pump/method/switch-off","name":"switch-off","parameters":[],"precondition":{"kind":"compare","left":{"arguments":[],"kind":"call","name":"mode"},"operator":"=","right":{"kind":"symbol","name":"running"}}}],"name":"pump","ports":[{"connector_type":"fluid-port","id":"domain/component/pump/port/inlet","name":"inlet","presence":"required"},{"connector_type":"fluid-port","id":"domain/component/pump/port/outlet","name":"outlet","presence":"optional"}],"processes":[],"requirements":[{"formula":{"kind":"compare","left":{"arguments":[{"field":"mass-flow","kind":"port_field","port":{"instance":{"anchor":"self","segments":[]},"port":"inlet"}},{"field":"mass-flow","kind":"port_field","port":{"instance":{"anchor":"self","segments":[]},"port":"outlet"}}],"kind":"arithmetic","operator":"+"},"operator":"=","right":{"kind":"number","value":"0"}},"id":"domain/component/pump/requirement/0"},{"formula":{"antecedent":{"kind":"compare","left":{"arguments":[],"kind":"call","name":"mode"},"operator":"=","right":{"kind":"symbol","name":"off"}},"consequent":{"kind":"compare","left":{"field":"mass-flow","kind":"port_field","port":{"instance":{"anchor":"self","segments":[]},"port":"inlet"}},"operator":"=","right":{"kind":"number","value":"0"}},"kind":"imply"},"id":"domain/component/pump/requirement/1"},{"formula":{"antecedent":{"kind":"compare","left":{"arguments":[],"kind":"call","name":"mode"},"operator":"=","right":{"kind":"symbol","name":"running"}},"consequent":{"kind":"compare","left":{"field":"mass-flow","kind":"port_field","port":{"instance":{"anchor":"self","segments":[]},"port":"inlet"}},"operator":"=","right":{"arguments":[],"kind":"call","name":"rated-flow"}},"kind":"imply"},"id":"domain/component/pump/requirement/2"}],"subcomponents":[],"variables":[{"id":"domain/component/pump/variable/mode","name":"mode","parameters":[],"static":false,"value_type":"object"},{"id":"domain/component/pump/variable/rated-flow","name":"rated-flow","parameters":[],"static":true,"value_type":"number"}]}],"connector_types":[{"fields":[{"category":"potential","name":"pressure","value_type":"number"},{"category":"flow","name":"mass-flow","value_type":"number"}],"id":"domain/connector/fluid-port","name":"fluid-port"}],"constants":[],"derived_predicates":[],"durative_actions":[],"events":[],"functions":[],"id":"domain","name":"pumped-fluid","predicates":[],"processes":[],"requirements":[":typing",":numeric-fluents",":components",":acausal-connectors",":component-presence",":events",":processes",":continuous-effects"],"types":[{"id":"domain/type/tank","name":"tank","parent":"component"},{"id":"domain/type/pump","name":"pump","parent":"component"}]},"format":"pddlica-json","language":{"host_features":["pddl2.1","pddl+","pddl3"],"host_language":"pddl","name":"pddlica","version":"0.5"},"metadata":{"extensions":{},"producer":"pddlica-parser-julia","producer_version":"0.1.0","semantic_digest":"sha256:25a935dbd8666762034d31a8b6c2cfabce7dfcab43fe2063f34234bb236e9e42"},"problem":{"components":[{"component_type":"tank","id":"problem/component/source","name":"source","present":true},{"component_type":"pump","id":"problem/component/transfer","name":"transfer","present":true},{"component_type":"tank","id":"problem/component/destination","name":"destination","present":true}],"connections":[{"id":"problem/connection/0","ports":[{"instance":{"anchor":"problem","segments":["source"]},"port":"outlet"},{"instance":{"anchor":"problem","segments":["transfer"]},"port":"inlet"}]},{"id":"problem/connection/1","ports":[{"instance":{"anchor":"problem","segments":["transfer"]},"port":"outlet"},{"instance":{"anchor":"problem","segments":["destination"]},"port":"inlet"}]}],"constraints":[],"domain":"pumped-fluid","goal":{"kind":"compare","left":{"arguments":[{"kind":"symbol","name":"destination"}],"kind":"call","name":"volume"},"operator":">=","right":{"kind":"number","value":"5"}},"id":"problem","init":[{"id":"problem/init/0","kind":"equality","left":{"arguments":[{"kind":"symbol","name":"source"}],"kind":"call","name":"volume"},"right":{"kind":"number","value":"10"}},{"id":"problem/init/1","kind":"equality","left":{"arguments":[{"kind":"symbol","name":"source"}],"kind":"call","name":"capacity"},"right":{"kind":"number","value":"20"}},{"id":"problem/init/2","kind":"equality","left":{"arguments":[{"kind":"symbol","name":"source"}],"kind":"call","name":"internal-pressure"},"right":{"kind":"number","value":"1"}},{"id":"problem/init/3","kind":"equality","left":{"arguments":[{"kind":"symbol","name":"transfer"}],"kind":"call","name":"mode"},"right":{"kind":"symbol","name":"off"}},{"id":"problem/init/4","kind":"equality","left":{"arguments":[{"kind":"symbol","name":"transfer"}],"kind":"call","name":"rated-flow"},"right":{"kind":"number","value":"1"}},{"id":"problem/init/5","kind":"equality","left":{"arguments":[{"kind":"symbol","name":"destination"}],"kind":"call","name":"volume"},"right":{"kind":"number","value":"0"}},{"id":"problem/init/6","kind":"equality","left":{"arguments":[{"kind":"symbol","name":"destination"}],"kind":"call","name":"capacity"},"right":{"kind":"number","value":"20"}},{"id":"problem/init/7","kind":"equality","left":{"arguments":[{"kind":"symbol","name":"destination"}],"kind":"call","name":"internal-pressure"},"right":{"kind":"number","value":"1"}}],"name":"pumped-fluid-demo","objects":[]},"source_map":{"documents":[{"content_digest":"sha256:b33d2681e46b66093e063a3359080616b66d2ab0f4ca372582246c84e004a699","id":"domain-source","logical_name":"domain.plca","role":"domain"},{"content_digest":"sha256:9e3e6da22720d1f0e5b4cdf075d85e981862b4d7cc2fef0963bd625af29bafcb","id":"problem-source","logical_name":"problem.plca","role":"problem"}],"locations":{}},"version":"0.1"}