{"domain":{"actions":[],"component_types":[{"connections":[],"events":[{"effect":{"kind":"assign","target":{"arguments":[],"kind":"call","name":"mode"},"value":{"kind":"symbol","name":"spent"}},"id":"domain/component/match/event/burn-out","name":"burn-out","parameters":[],"precondition":{"items":[{"kind":"compare","left":{"arguments":[],"kind":"call","name":"mode"},"operator":"=","right":{"kind":"symbol","name":"burning"}},{"kind":"compare","left":{"arguments":[],"kind":"call","name":"fuel"},"operator":"<=","right":{"kind":"number","value":"0"}}],"kind":"and"}}],"id":"domain/component/match","methods":[{"effect":{"kind":"assign","target":{"arguments":[],"kind":"call","name":"mode"},"value":{"kind":"symbol","name":"burning"}},"id":"domain/component/match/method/ignite","name":"ignite","parameters":[],"precondition":{"kind":"compare","left":{"arguments":[],"kind":"call","name":"mode"},"operator":"=","right":{"kind":"symbol","name":"unlit"}}}],"name":"match","ports":[],"processes":[{"effects":[{"operator":"decrease","rate":{"kind":"number","value":"1"},"target":{"arguments":[],"kind":"call","name":"fuel"}}],"id":"domain/component/match/process/burn","name":"burn","parameters":[],"precondition":{"kind":"compare","left":{"arguments":[],"kind":"call","name":"mode"},"operator":"=","right":{"kind":"symbol","name":"burning"}}}],"requirements":[],"subcomponents":[],"variables":[{"id":"domain/component/match/variable/mode","name":"mode","parameters":[],"static":false,"value_type":"object"},{"id":"domain/component/match/variable/fuel","name":"fuel","parameters":[],"static":false,"value_type":"number"}]}],"connector_types":[],"constants":[],"derived_predicates":[],"durative_actions":[],"events":[],"functions":[],"id":"domain","name":"match-ms-adaptation","predicates":[],"processes":[],"requirements":[":typing",":numeric-fluents",":components",":events",":processes",":continuous-effects"],"types":[{"id":"domain/type/match","name":"match","parent":"component"}]},"format":"pddlica-json","language":{"host_features":["pddl2.1","pddl+","pddl3"],"host_language":"pddl","name":"pddlica","version":"0.5"},"metadata":{"extensions":{},"producer":"pddlica-parser-julia","producer_version":"0.1.0","semantic_digest":"sha256:c184fa3b6f3208fb895371130c58479e43ba19ca7550c11b1614fc89b56ed53d"},"problem":{"components":[{"component_type":"match","id":"problem/component/match-1","name":"match-1","present":true}],"connections":[],"constraints":[],"domain":"match-ms-adaptation","goal":{"kind":"compare","left":{"arguments":[{"kind":"symbol","name":"match-1"}],"kind":"call","name":"mode"},"operator":"=","right":{"kind":"symbol","name":"spent"}},"id":"problem","init":[{"id":"problem/init/0","kind":"equality","left":{"arguments":[{"kind":"symbol","name":"match-1"}],"kind":"call","name":"mode"},"right":{"kind":"symbol","name":"unlit"}},{"id":"problem/init/1","kind":"equality","left":{"arguments":[{"kind":"symbol","name":"match-1"}],"kind":"call","name":"fuel"},"right":{"kind":"number","value":"1"}}],"name":"match-ms-demo","objects":[]},"source_map":{"documents":[{"content_digest":"sha256:f7a89c1834b17dff5509817d8bf4da8c903ceb86586117cf03b6dec0ec4d2137","id":"domain-source","logical_name":"domain.plca","role":"domain"},{"content_digest":"sha256:3d07e4c48919c5deab93cb6ba3aba89876455e581a047d19e1e32b6c18dc6508","id":"problem-source","logical_name":"problem.plca","role":"problem"}],"locations":{}},"version":"0.1"}